{
  "duration": 2.8,
  "layers": [
    {
      "name": "spin_down",
      "type": "osc",
      "wave": "saw",
      "freq": {
        "from": 180,
        "to": 28,
        "curve": "exp"
      },
      "harmonics": [
        1,
        0.5,
        0.3
      ],
      "gain": -6,
      "envelope": {
        "attack": 0.01,
        "release": 1.3
      },
      "filter": {
        "type": "lowpass",
        "freq": {
          "from": 2400,
          "to": 140,
          "curve": "exp"
        }
      }
    },
    {
      "name": "relay_off",
      "type": "click",
      "freq": 1300,
      "decay": 0.01,
      "gain": -10
    }
  ],
  "effects": [
    {
      "type": "reverb",
      "room": 0.6,
      "mix": 0.25
    }
  ],
  "normalize": {
    "lufs": -17
  }
}
