{
  "duration": 0.4,
  "layers": [
    {
      "type": "fm",
      "carrier": 620,
      "ratio": 1.5,
      "index": {
        "from": 6,
        "to": 2
      },
      "gain": -6,
      "envelope": {
        "attack": 0.01,
        "release": 0.2
      },
      "effects": [
        {
          "type": "tremolo",
          "rate": 35,
          "depth": 0.7
        }
      ]
    },
    {
      "type": "noise",
      "color": "white",
      "gain": -20,
      "envelope": {
        "attack": 0.005,
        "release": 0.1
      },
      "filter": {
        "type": "bandpass",
        "freq": 2500,
        "q": 2
      }
    }
  ],
  "effects": [
    {
      "type": "reverb",
      "room": 0.35,
      "mix": 0.12
    }
  ],
  "normalize": {
    "lufs": -17
  }
}
