{
  "duration": 1.6,
  "layers": [
    {
      "type": "fm",
      "carrier": {
        "from": 180,
        "to": 720,
        "curve": "exp"
      },
      "ratio": 1.5,
      "index": {
        "from": 1,
        "to": 6
      },
      "gain": -7,
      "envelope": {
        "attack": 0.3,
        "release": 0.6
      }
    },
    {
      "type": "noise",
      "color": "white",
      "gain": -14,
      "envelope": {
        "attack": 0.6,
        "release": 0.4
      },
      "filter": {
        "type": "bandpass",
        "freq": {
          "from": 400,
          "to": 5000,
          "curve": "exp"
        },
        "q": 4
      }
    },
    {
      "type": "impact",
      "start": 0.7,
      "freq": 70,
      "decay": 0.5,
      "noise": 0.6,
      "gain": -8
    }
  ],
  "effects": [
    {
      "type": "reverb",
      "room": 0.9,
      "mix": 0.35
    }
  ],
  "normalize": {
    "lufs": -16
  }
}
